# name: test/sql/function/list/aggregates/BIGINT.test
# description: Test BIGINT aggregates
# group: [aggregates]

statement ok
CREATE TABLE BIGINTs(h BIGINT[])

statement ok
INSERT INTO BIGINTs VALUES ([NULL, 1, 2]), (NULL), ([]), ([NULL]), ([1, 2, 3])

query III
SELECT list_first(h), list_last(h), list_sum(h) FROM BIGINTs
----
NULL	2	3
NULL	NULL	NULL
NULL	NULL	NULL
NULL	NULL	NULL
1	3	6

statement ok
DELETE FROM BIGINTs

statement ok
INSERT INTO BIGINTs VALUES ([42.0, 1267650600228229401496703205376, -439847238974238975238975, '-12']);

query IIIII
SELECT list_min(h), list_max(h), list_sum(h), list_first(h), list_last(h) FROM BIGINTs;
----
-439847238974238975238975	1267650600228229401496703205376	1267650160380990427257727966431	42	-12

